Most Negative Headlines,Most Positive Headlines
"Market your SaaS to get more sales, with no stress.",Craft Stunning Grids. Showcase Rich and Beautiful.
"Stop losing money gambling, start investing",The Adventure of ____: Bravery Hands of the Harmony Land
Bring Discord functionality into HubSpot in a few clicks,Attract high-end clients through architecture awards
Stop paying 0.4% for Stripe invoices,"Submit Your Startup to 100+ Directories. Attract early adopters, increase traffic and build backl..."
Don't let a dispute get you banned from Stripe,Create Stunning Videos Instantly with a Single Prompt.
